{
  "session_id": "8ae04254-6c0c-4c7e-9944-04bc25808345",
  "status": "active",
  "cv_data": {
    "filename": "Mohamed_Khaled_ML.pdf",
    "content": "MOHAMED KHALED GHAREEB  \nAI & Machine Learning Engineer | NLP | Computer Vision  \nLinkedIn: linkedin.com/in/mohamed -khaled -3a9021263 | GitHub: github.com/ghreeb1  | Email: \nqq11gharipqq11@gmail.com  \nPROFESSIONAL SUMMARY  \nResults -driven AI & Machine Learning Engineer with strong expertise in developing and \ndeploying AI -powered solutions. Proficient in NLP, Computer Vision, Deep Learning, and MLOps. \nAdept at solving complex problems, optimizing performance, and delivering innovative projects \nin agile environments. Passionate about leveraging AI to create impactful solutions.  \nCORE COMPETENCIES  \n• Machine Learning (Supervised & Unsupervised)  • Deep Learning (CNN, RNN, Transformers)  \n• Computer Vision (Image Processing, Object Detection)  • NLP (LLMs, RAG, Chatbots)  \n• Python, PyTorch, TensorFlow, Scikit -learn  • FastAPI, Docker, Git, AWS  \n• Data Analysis & Visualization (Pandas, NumPy, Matplotlib, Seaborn)  \nEDUCATION  \nBachelor of Artificial Intelligence, Menoufia University  \nSpecialization: Machine Intelligence | GPA: 2.71/4.0 (Good)  \nExpected Graduation: January 2026  \nCERTIFICATIONS & TRAINING  \n• Artificial Intelligence Summer Training – National Telecommunication Institute (NTI), 2022  \n• Odoo ERP Training, 2024: AI Integration, Financial Transactions, Sales & Inventory  \nKEY PROJECTS  \nMemorixal — AI Caregiver Assistant  \n• Designed and deployed an AI assistant enabling caregivers to communicate effectively with \nmemory -impaired patients.  \n• Integrated document ingestion, semantic search, and a web interface, improving response \nrelevance by 40%.  \n \nCharacter Simulator RAG System  \n• Built a scalable character simulation system supporting multi -character interactions using \nLangChain & FAISS.  \n \nEye Disease Detection  \n• Trained a CNN model achieving 92% validation accuracy for classifying eye diseases.  \n \nTherapist Chatbot  \n• Developed a therapeutic chatbot improving user engagement by 30% and reducing latency by \n4 seconds.  \nTECHNICAL SKILLS  \n• Programming: Python  \n• Frameworks: PyTorch, TensorFlow, FastAPI, Flask  \n• Tools: Docker, Git, AWS, CI/CD Pipelines  \n• Databases: MySQL, MongoDB  \nSOFT SKILLS  \nLeadership, Problem -Solving, Agile Team Collaboration, Communication  \nLANGUAGES  \nEnglish: Advanced (Reading & Writing)",
    "skills": [
      "Machine Learning",
      "Tensorflow",
      "Aws",
      "Agile",
      "Artificial Intelligence",
      "Mongodb",
      "Deep Learning",
      "Matplotlib",
      "Sql",
      "Python",
      "Pandas",
      "Pytorch",
      "Mysql",
      "Numpy",
      "Git",
      "Flask",
      "Leadership",
      "Communication",
      "Docker"
    ],
    "education": [
      "Bachelor of Artificial Intelligence, Menoufia University",
      "CERTIFICATIONS & TRAINING",
      "• Artificial Intelligence Summer Training – National Telecommunication Institute (NTI), 2022"
    ],
    "experience": [
      "AI & Machine Learning Engineer | NLP | Computer Vision",
      "Results -driven AI & Machine Learning Engineer with strong expertise in developing and",
      "• Frameworks: PyTorch, TensorFlow, FastAPI, Flask",
      "Leadership, Problem -Solving, Agile Team Collaboration, Communication"
    ],
    "contact_info": {
      "email": "qq11gharipqq11@gmail.com",
      "linkedin": "linkedin.com/in/mohamed"
    },
    "parsed_at": "2025-08-14T12:27:45.484281"
  },
  "messages": [
    {
      "role": "interviewer",
      "content": "Hello, I'm your AI interviewer.\n\nTo begin, please introduce yourself—your background, key skills, and recent work.\n\nWe'll keep this to about 15 minutes. After your introduction, we'll go through 8 questions.\n\nHere are the remaining interview questions planned:\n1. How have you used Tensorflow in your previous projects?\n2. Can you tell me about your experience with Machine Learning?\n3. Where do you see yourself in 5 years?\n4. What are your greatest strengths?\n5. What interests you most about this role?\n6. Can you tell me about your experience with Aws?\n7. How do you handle working under pressure?\n8. What challenges have you faced while working with Aws?",
      "timestamp": "2025-08-14T12:27:48.430859",
      "audio_duration": null
    }
  ],
  "behavior_metrics": [],
  "start_time": "2025-08-14T12:27:48.426648",
  "end_time": null,
  "duration_seconds": 0,
  "max_duration_seconds": 900,
  "questions": [
    "How have you used Tensorflow in your previous projects?",
    "Can you tell me about your experience with Machine Learning?",
    "Where do you see yourself in 5 years?",
    "What are your greatest strengths?",
    "What interests you most about this role?",
    "Can you tell me about your experience with Aws?",
    "How do you handle working under pressure?",
    "What challenges have you faced while working with Aws?"
  ],
  "total_questions": 8,
  "questions_asked": 0
}