{
  "session_id": "9bde02bd-0edd-4901-975c-4063197e29e8",
  "status": "completed",
  "cv_data": {
    "filename": "Mohamed_Khaled_ML.pdf",
    "content": "MOHAMED KHALED GHAREEB  \nAI & Machine Learning Engineer | NLP | Computer Vision  \nLinkedIn: linkedin.com/in/mohamed -khaled -3a9021263 | GitHub: github.com/ghreeb1  | Email: \nqq11gharipqq11@gmail.com  \nPROFESSIONAL SUMMARY  \nResults -driven AI & Machine Learning Engineer with strong expertise in developing and \ndeploying AI -powered solutions. Proficient in NLP, Computer Vision, Deep Learning, and MLOps. \nAdept at solving complex problems, optimizing performance, and delivering innovative projects \nin agile environments. Passionate about leveraging AI to create impactful solutions.  \nCORE COMPETENCIES  \n• Machine Learning (Supervised & Unsupervised)  • Deep Learning (CNN, RNN, Transformers)  \n• Computer Vision (Image Processing, Object Detection)  • NLP (LLMs, RAG, Chatbots)  \n• Python, PyTorch, TensorFlow, Scikit -learn  • FastAPI, Docker, Git, AWS  \n• Data Analysis & Visualization (Pandas, NumPy, Matplotlib, Seaborn)  \nEDUCATION  \nBachelor of Artificial Intelligence, Menoufia University  \nSpecialization: Machine Intelligence | GPA: 2.71/4.0 (Good)  \nExpected Graduation: January 2026  \nCERTIFICATIONS & TRAINING  \n• Artificial Intelligence Summer Training – National Telecommunication Institute (NTI), 2022  \n• Odoo ERP Training, 2024: AI Integration, Financial Transactions, Sales & Inventory  \nKEY PROJECTS  \nMemorixal — AI Caregiver Assistant  \n• Designed and deployed an AI assistant enabling caregivers to communicate effectively with \nmemory -impaired patients.  \n• Integrated document ingestion, semantic search, and a web interface, improving response \nrelevance by 40%.  \n \nCharacter Simulator RAG System  \n• Built a scalable character simulation system supporting multi -character interactions using \nLangChain & FAISS.  \n \nEye Disease Detection  \n• Trained a CNN model achieving 92% validation accuracy for classifying eye diseases.  \n \nTherapist Chatbot  \n• Developed a therapeutic chatbot improving user engagement by 30% and reducing latency by \n4 seconds.  \nTECHNICAL SKILLS  \n• Programming: Python  \n• Frameworks: PyTorch, TensorFlow, FastAPI, Flask  \n• Tools: Docker, Git, AWS, CI/CD Pipelines  \n• Databases: MySQL, MongoDB  \nSOFT SKILLS  \nLeadership, Problem -Solving, Agile Team Collaboration, Communication  \nLANGUAGES  \nEnglish: Advanced (Reading & Writing)",
    "skills": [
      "Docker",
      "Aws",
      "Leadership",
      "Flask",
      "Pytorch",
      "Machine Learning",
      "Artificial Intelligence",
      "Deep Learning",
      "Mysql",
      "Numpy",
      "Communication",
      "Matplotlib",
      "Sql",
      "Pandas",
      "Mongodb",
      "Tensorflow",
      "Git",
      "Agile",
      "Python"
    ],
    "education": [
      "Bachelor of Artificial Intelligence, Menoufia University",
      "CERTIFICATIONS & TRAINING",
      "• Artificial Intelligence Summer Training – National Telecommunication Institute (NTI), 2022"
    ],
    "experience": [
      "AI & Machine Learning Engineer | NLP | Computer Vision",
      "Results -driven AI & Machine Learning Engineer with strong expertise in developing and",
      "• Frameworks: PyTorch, TensorFlow, FastAPI, Flask",
      "Leadership, Problem -Solving, Agile Team Collaboration, Communication"
    ],
    "contact_info": {
      "email": "qq11gharipqq11@gmail.com",
      "linkedin": "linkedin.com/in/mohamed"
    },
    "parsed_at": "2025-08-11T22:12:06.862161"
  },
  "messages": [
    {
      "role": "interviewer",
      "content": "I'd like to start by discussing your recent project as an AI & Machine Learning Engineer. Can you walk me through the challenges you faced while implementing PyTorch for a computer vision task, and how you overcame them? \n\nAlso, I noticed that you mentioned NLP and Computer Vision in your CV - can you tell me which specific application of NLP or Computer Vision you're more passionate about and why?",
      "timestamp": "2025-08-11T22:12:27.478413",
      "audio_duration": null
    },
    {
      "role": "candidate",
      "content": "i did will",
      "timestamp": "2025-08-11T22:14:05.218735",
      "audio_duration": null
    },
    {
      "role": "interviewer",
      "content": "It seems like the candidate provided a brief \"i did will\" without offering any meaningful details. As an interviewer, I would ask follow-up questions to delve deeper into their thoughts and experiences.\n\nHere's my next question:\n\nCan you elaborate on what specific challenges you faced while implementing PyTorch for your computer vision task, and how you were able to overcome them? What lessons did you learn from the experience that you can apply to future projects?\n\nAnd, regarding NLP or Computer Vision, I'd",
      "timestamp": "2025-08-11T22:14:19.034371",
      "audio_duration": null
    }
  ],
  "behavior_metrics": [],
  "start_time": "2025-08-11T22:12:11.021927",
  "end_time": "2025-08-11T22:15:47.494264",
  "duration_seconds": 216,
  "max_duration_seconds": 900
}