{
  "session_id": "ab233538-73ce-451a-90b2-06fec6f186b5",
  "status": "active",
  "cv_data": {
    "filename": "Mohamed_Khaled_ML.pdf",
    "content": "MOHAMED KHALED GHAREEB  \nAI & Machine Learning Engineer | NLP | Computer Vision  \nLinkedIn: linkedin.com/in/mohamed -khaled -3a9021263 | GitHub: github.com/ghreeb1  | Email: \nqq11gharipqq11@gmail.com  \nPROFESSIONAL SUMMARY  \nResults -driven AI & Machine Learning Engineer with strong expertise in developing and \ndeploying AI -powered solutions. Proficient in NLP, Computer Vision, Deep Learning, and MLOps. \nAdept at solving complex problems, optimizing performance, and delivering innovative projects \nin agile environments. Passionate about leveraging AI to create impactful solutions.  \nCORE COMPETENCIES  \n• Machine Learning (Supervised & Unsupervised)  • Deep Learning (CNN, RNN, Transformers)  \n• Computer Vision (Image Processing, Object Detection)  • NLP (LLMs, RAG, Chatbots)  \n• Python, PyTorch, TensorFlow, Scikit -learn  • FastAPI, Docker, Git, AWS  \n• Data Analysis & Visualization (Pandas, NumPy, Matplotlib, Seaborn)  \nEDUCATION  \nBachelor of Artificial Intelligence, Menoufia University  \nSpecialization: Machine Intelligence | GPA: 2.71/4.0 (Good)  \nExpected Graduation: January 2026  \nCERTIFICATIONS & TRAINING  \n• Artificial Intelligence Summer Training – National Telecommunication Institute (NTI), 2022  \n• Odoo ERP Training, 2024: AI Integration, Financial Transactions, Sales & Inventory  \nKEY PROJECTS  \nMemorixal — AI Caregiver Assistant  \n• Designed and deployed an AI assistant enabling caregivers to communicate effectively with \nmemory -impaired patients.  \n• Integrated document ingestion, semantic search, and a web interface, improving response \nrelevance by 40%.  \n \nCharacter Simulator RAG System  \n• Built a scalable character simulation system supporting multi -character interactions using \nLangChain & FAISS.  \n \nEye Disease Detection  \n• Trained a CNN model achieving 92% validation accuracy for classifying eye diseases.  \n \nTherapist Chatbot  \n• Developed a therapeutic chatbot improving user engagement by 30% and reducing latency by \n4 seconds.  \nTECHNICAL SKILLS  \n• Programming: Python  \n• Frameworks: PyTorch, TensorFlow, FastAPI, Flask  \n• Tools: Docker, Git, AWS, CI/CD Pipelines  \n• Databases: MySQL, MongoDB  \nSOFT SKILLS  \nLeadership, Problem -Solving, Agile Team Collaboration, Communication  \nLANGUAGES  \nEnglish: Advanced (Reading & Writing)",
    "skills": [
      "Sql",
      "Git",
      "Agile",
      "Pandas",
      "Aws",
      "Communication",
      "Artificial Intelligence",
      "Docker",
      "Flask",
      "Pytorch",
      "Leadership",
      "Deep Learning",
      "Python",
      "Matplotlib",
      "Tensorflow",
      "Numpy",
      "Machine Learning",
      "Mysql",
      "Mongodb"
    ],
    "education": [
      "Bachelor of Artificial Intelligence, Menoufia University",
      "CERTIFICATIONS & TRAINING",
      "• Artificial Intelligence Summer Training – National Telecommunication Institute (NTI), 2022"
    ],
    "experience": [
      "AI & Machine Learning Engineer | NLP | Computer Vision",
      "Results -driven AI & Machine Learning Engineer with strong expertise in developing and",
      "• Frameworks: PyTorch, TensorFlow, FastAPI, Flask",
      "Leadership, Problem -Solving, Agile Team Collaboration, Communication"
    ],
    "contact_info": {
      "email": "qq11gharipqq11@gmail.com",
      "linkedin": "linkedin.com/in/mohamed"
    },
    "parsed_at": "2025-08-11T20:24:21.095852"
  },
  "messages": [
    {
      "role": "interviewer",
      "content": "Based on the CV context and recent conversation, here are some follow-up questions to ask the candidate:\n\n1. You mentioned your experience as an AI & Machine Learning Engineer with a focus on NLP and Computer Vision. Can you elaborate on how you've applied these skills in real-world projects, and what specific challenges you overcame?\n\n2. In our previous discussion, we touched on the importance of communication in team environments. How do you ensure that technical information is conveyed effectively to both technical and non-",
      "timestamp": "2025-08-11T20:24:40.166410",
      "audio_duration": null
    }
  ],
  "behavior_metrics": [],
  "start_time": "2025-08-11T20:24:24.744554",
  "end_time": null,
  "duration_seconds": 0,
  "max_duration_seconds": 900
}