{
  "session_id": "cd644c9d-bbe4-4a7a-acd2-f230eb5b0559",
  "status": "completed",
  "cv_data": {
    "filename": "Mohamed_Khaled_ML.pdf",
    "content": "MOHAMED KHALED GHAREEB  \nAI & Machine Learning Engineer | NLP | Computer Vision  \nLinkedIn: linkedin.com/in/mohamed -khaled -3a9021263 | GitHub: github.com/ghreeb1  | Email: \nqq11gharipqq11@gmail.com  \nPROFESSIONAL SUMMARY  \nResults -driven AI & Machine Learning Engineer with strong expertise in developing and \ndeploying AI -powered solutions. Proficient in NLP, Computer Vision, Deep Learning, and MLOps. \nAdept at solving complex problems, optimizing performance, and delivering innovative projects \nin agile environments. Passionate about leveraging AI to create impactful solutions.  \nCORE COMPETENCIES  \n• Machine Learning (Supervised & Unsupervised)  • Deep Learning (CNN, RNN, Transformers)  \n• Computer Vision (Image Processing, Object Detection)  • NLP (LLMs, RAG, Chatbots)  \n• Python, PyTorch, TensorFlow, Scikit -learn  • FastAPI, Docker, Git, AWS  \n• Data Analysis & Visualization (Pandas, NumPy, Matplotlib, Seaborn)  \nEDUCATION  \nBachelor of Artificial Intelligence, Menoufia University  \nSpecialization: Machine Intelligence | GPA: 2.71/4.0 (Good)  \nExpected Graduation: January 2026  \nCERTIFICATIONS & TRAINING  \n• Artificial Intelligence Summer Training – National Telecommunication Institute (NTI), 2022  \n• Odoo ERP Training, 2024: AI Integration, Financial Transactions, Sales & Inventory  \nKEY PROJECTS  \nMemorixal — AI Caregiver Assistant  \n• Designed and deployed an AI assistant enabling caregivers to communicate effectively with \nmemory -impaired patients.  \n• Integrated document ingestion, semantic search, and a web interface, improving response \nrelevance by 40%.  \n \nCharacter Simulator RAG System  \n• Built a scalable character simulation system supporting multi -character interactions using \nLangChain & FAISS.  \n \nEye Disease Detection  \n• Trained a CNN model achieving 92% validation accuracy for classifying eye diseases.  \n \nTherapist Chatbot  \n• Developed a therapeutic chatbot improving user engagement by 30% and reducing latency by \n4 seconds.  \nTECHNICAL SKILLS  \n• Programming: Python  \n• Frameworks: PyTorch, TensorFlow, FastAPI, Flask  \n• Tools: Docker, Git, AWS, CI/CD Pipelines  \n• Databases: MySQL, MongoDB  \nSOFT SKILLS  \nLeadership, Problem -Solving, Agile Team Collaboration, Communication  \nLANGUAGES  \nEnglish: Advanced (Reading & Writing)",
    "skills": [
      "Matplotlib",
      "Tensorflow",
      "Sql",
      "Aws",
      "Git",
      "Mysql",
      "Docker",
      "Mongodb",
      "Machine Learning",
      "Pytorch",
      "Pandas",
      "Artificial Intelligence",
      "Communication",
      "Deep Learning",
      "Numpy",
      "Leadership",
      "Agile",
      "Flask",
      "Python"
    ],
    "education": [
      "Bachelor of Artificial Intelligence, Menoufia University",
      "CERTIFICATIONS & TRAINING",
      "• Artificial Intelligence Summer Training – National Telecommunication Institute (NTI), 2022"
    ],
    "experience": [
      "AI & Machine Learning Engineer | NLP | Computer Vision",
      "Results -driven AI & Machine Learning Engineer with strong expertise in developing and",
      "• Frameworks: PyTorch, TensorFlow, FastAPI, Flask",
      "Leadership, Problem -Solving, Agile Team Collaboration, Communication"
    ],
    "contact_info": {
      "email": "qq11gharipqq11@gmail.com",
      "linkedin": "linkedin.com/in/mohamed"
    },
    "parsed_at": "2025-08-11T20:07:06.190409"
  },
  "messages": [
    {
      "role": "interviewer",
      "content": "Let's get started with the interview. Can you tell me more about your experience with TensorFlow, specifically how you've applied it to real-world projects or problems?\n\n(Also, I'll be taking note of your responses to tailor my follow-up questions)",
      "timestamp": "2025-08-11T20:07:19.733734",
      "audio_duration": null
    },
    {
      "role": "candidate",
      "content": "Pretty good at it",
      "timestamp": "2025-08-11T20:07:55.680937",
      "audio_duration": null
    },
    {
      "role": "interviewer",
      "content": "It seems like the candidate struggled to elaborate on their experience with TensorFlow. Here's a potential follow-up question:\n\nCan you provide a specific example or project where you successfully applied TensorFlow to solve a real-world problem, such as image classification, natural language processing, or predictive analytics?\n\n(I'll be taking note of your responses to tailor further follow-up questions)",
      "timestamp": "2025-08-11T20:08:07.426038",
      "audio_duration": null
    }
  ],
  "behavior_metrics": [],
  "start_time": "2025-08-11T20:07:09.833681",
  "end_time": "2025-08-11T20:08:55.568366",
  "duration_seconds": 105,
  "max_duration_seconds": 900
}